3/13/2024 13:14:11,3/13/2024,4277,CESC50XP,Food Forward,Art,,Woman,,Hispanic/Latinx,No,Graduate,Graduate,No,3.75 to 4.0,3,2,5,3,5,3,5,5,5,4,5,5,5,5,1,5,3,"Throughout my community engagement experience, I noticed that workers in the farmers market who shared my Latino ethnicity were more willing to donate food to our organization.  This is likely due to the fact that they felt more comfortable interacting with someone who shared their cultural background. I realized that a more diverse group of volunteers would likely yield better results in food collection. If workers feel like they can connect more deeply with volunteers due to similar cultural background, this may increase their willingness to assist the organization. This can also be applied to other fields of work and emphasizes the importance of increasing diversity in the workforce. ","I effectively worked with my community partner to understand the organization's goals and more effectively participate in executing its mission. I then communicated these goals to local farmers market vendors, allowing me to collect food for distribution to under-resourced communities. Through this experience, I was able to support marginalized communities in accessing necessary sustenance, which they would have otherwise struggled to attain. "
3/13/2024 16:06:39,3/13/2024,9474,CESC50XP,UCLA Early Academic Outreach Program,Psychology,,Woman,,Hispanic/Latinx,Yes,High School or Less,High School of Less,No,3.0 to 3.5,2,3,4,3,5,4,5,5,4,4,5,5,5,5,2,4,5,It taught me how critical these topics are because they are actively impacting so many people. It made me feel more passionate in finding a theory of change.,I helped research scholarship resources to an underserved Latinx high school. I supported these students in reviewing their scholarship applications to help eliminate the barrier of financial boundaries when seeking higher education.
3/13/2024 16:34:55,3/13/2024,9217,CESC50XP,Little Tokyo Service Center (Mi CASA Afterschool Program) TRACK1,Physiological Sciences,N/A,Woman,N/A,"Asian / Pacific Islander, Hispanic/Latinx",No,High School or Less,Two-year College,No,3.5 to 3.75,2,2,4,2,5,4,4,5,5,4,5,5,5,5,1,5,5,"My community engagement experience impacted my learning about diversity because the program was located in downtown LA which has a pretty different demographic and environment than UCLA/ Beverly Hills area. The demographic differs as I saw much more homeless, low income people around Little Tokyo. Additionally, most of the families utilizing the afterschool program lived in the ""affordable housing"" program provided by the Little Tokyo Service Center. Secondly, the diversity in the environment was very apparent to me as streets became narrower and many more businesses and buildings surrounded/ almost crowded the streets. Overall, my knowledge of diversity expanded after realizing the very different day to day lives everyone lives and the variety of realities that people experience. At first reading the word ""diversity,"" I thought of race, but race was not something that stuck out to me as both the Beverly Hills and downtown parts of LA were made up of people of all races/ ethnicities.","This quarter I contributed to the Little Tokyo Service Center by helping out/volunteering at their Mi CASA afterschool program. There was usually only one or two other staff members, so I think being there, I helped take some kids off of their hands. Especially being in college and still having a lot of energy, I was able to play with multiple kids in the gym and engage in a variety of sport/ active activities with them. I was also able to form meaningful connections with a few of the kids at the program since I would go at the same time and day each week. Not only did I engage in different activities with the kids, but I assisted them with homework and made sure they were safe at all times. Before the kids arrived, I helped set up the room for the program; and, after the kids left, I would help clean up the room and put any books, drawing materials, basketballs, etc.. back to where they belong."
3/13/2024 17:12:26,3/13/2024,2169,CESC50XP,Social Justice Learning Institute,Global Studies,n/a,Woman,,Multiple Ethnicity / Other,No,Four-year College,Graduate,No,3.75 to 4.0,3,2,4,2,4,5,5,4,4,5,5,4,5,4,2,4,4,This is my second submission so I can get a screenshot of the submission page. It impacted my learning about diversity by showing me that just because someone is part of a marginalized group it does not mean they're aware that all marginalized groups' oppression is interconnected. ,"I contributed preparing food bags, distributing food bags, writing student profiles, sending emails, helping with SJLI social media, and helping SJLI prepare for their culmination. "
3/13/2024 17:35:25,3/13/2024,6731,CESC50XP,Step Up Tutoring,Math,,Woman,,Asian / Pacific Islander,Yes,Two-year College,Two-year College,No,3.75 to 4.0,3,3,4,2,4,4,5,4,4,4,4,4,4,4,1,4,4,I learned more about inequities in education.,I helped with tutor recruitment and provided feedback on their tutor recruitment process and created promotional flyers for them.
3/13/2024 17:37:41,3/12/2024,2627,CESC50XP,Mar Vista Family Center,Chemistry,,Woman,,White,No,Graduate,Four-year College,No,3.75 to 4.0,3,3,4,2,5,5,3,4,5,3,4,5,5,5,2,5,5,"I enjoyed working in a diverse community with students of various cultural backgrounds. I was able to expand my ideas surrounding what it means to grow up in Los Angeles, and had a great time working with students from lots of different perspectives. ","I was able to work with a range of students, tutoring in math, spanish and english. I worked with kids as young as 5 and as old as 17. I was especially useful with highschoolers given my STEM background. I also helped to begin putting together a chemistry curriculum for the highschool students."
3/13/2024 17:58:43,3/13/2024,7483,CESC50XP,Food Oasis,MCDB,,Woman,,Asian / Pacific Islander,Yes,High School or Less,High School of Less,,3.75 to 4.0,3,2,4,3,4,5,5,3,4,5,5,5,5,4,4,5,5,"When I am doing the community engagement work, I learned diffferent food banks that offer the free food and also have a background on who is major population that recevice the help",Supportitive
3/13/2024 18:23:35,3/13/2024,5268,CESC50XP,LA Forward,Political Science,N/A,Man,,"White, Multiple Ethnicity / Other",Yes,High School or Less,High School of Less,Yes,3.75 to 4.0,3,3,5,3,2,5,5,4,5,5,5,5,3,4,2,5,5,It gave me new insight on problems that I did not know about.,I helped minorities reach politicians who are fighting for their benefits. 
3/13/2024 19:11:05,3/13/2024,1408,CESC50XP,Little Tokyo Service Center (LTSC),Global Studies,No Minor,Man,,Asian / Pacific Islander,No,Two-year College,Four-year College,No,3.75 to 4.0,3,3,5,4,4,5,5,5,4,4,4,4,5,4,1,4,5,"After working with the LTSC, I learned that diversity in a community is a strength, not a weakness. Having a community filled with residents from different communities help formulate ideas from differing backgrounds. These differing ideas all have the potential to work with each other, creating solutions to problems that would not have been made if everyone came from the same background. When working with LTSC, it helped a lot that Gary and I were from different country/origins. We were able to work off of each others background as well as everyone else's backgrounds to formulate plans. ","At LTSC, I contributed to their mission by analyzing their survey responses for Suehiro Cafe, sorted them out, and created graphic designs to help promote their relocation. My job was essentially catered to Kenji, who was the owner of Suehiro Cafe. "
3/13/2024 19:16:47,3/13/2024,7331,CESC50XP,Food Oasis,Biology,,Man,,Asian / Pacific Islander,Yes,High School or Less,High School of Less,No,3.0 to 3.5,2,2,4,3,4,4,4,4,5,3,4,5,3,4,2,4,5,"While working in my community engagement I learned that people of all ethnicities are affected by a lack of food and poverty.  I have called several different food pantries that is aiming towards Latinos, Koreans, etc. showing me that people of all ethnicities are affected by the need of food resources. The fact that these types of food pantries exist shows the issues and problem different people and families go through with some food pantries targeting younger adults, elderly, etc. This shows that this is an issue that impacts different people and not just one group/individuals. ","What I did for my community partner this quarter was updating the database of their website regarding food pantries found in Los Angeles. I would update the info including location, hours, and types of food/benefits provided. This is to target the families in Los Angeles that need food resources near them, by providing them a website to use where they can find these resources. "
3/13/2024 20:18:19,3/13/2024,741,CESC50XP,Food Oasis,Business Economics,N/A,Man,,Hispanic/Latinx,No,Graduate,Graduate,No,3.75 to 4.0,3,2,4,3,4,4,5,4,5,4,4,5,5,4,2,4,4,My community engagement experience helped me become a more open-mindedn and culturally competent person and understand the increasingly diverse world. ,Helped them update their food programs/pantries listings on their website. 
3/13/2024 20:43:48,3/13/2024,9745,CESC50XP,Stop LAPD Spying Coalition,"Neuroscience, B.S.",Biomedical Research,Woman,,Asian / Pacific Islander,No,Four-year College,Four-year College,No,3.75 to 4.0,3,3,5,4,4,4,4,4,4,4,4,5,5,5,5,5,5,It definitely got me to think more about how people from different backgrounds have their own set of challenges and issues they face.,"I think I learned so much about unfair policing systems in place. I was able to contribute by compiling lists of organizations that volunteers can reach out to, an email template and creating infographics about various different initiatives."
3/13/2024 21:29:25,3/13/2024,8976,CESC50XP,Jewish Family Service of LA,Bioengineering,N/A,Man,,Asian / Pacific Islander,No,Four-year College,Four-year College,No,3.75 to 4.0,3,3,4,2,3,4,3,4,4,4,4,4,4,4,2,4,3,My community engagement experience expanded my perspectives on those affect by inequalities as it shifted away from blaming them for their situations and more towards the fact that history itself has been against them the entire time.,I contributed my time in provided deficit-based needs to those in need of food. I bagged tons of carts of food and handed out many of them as well. I helped those unhoused and struggling to keep a roof over their heads by giving them the relief of not having to worry about food insecurities.
3/13/2024 21:35:22,3/13/2024,7458,CESC50XP,LA Forward,Pre-psychology,,Woman,,Asian / Pacific Islander,No,Four-year College,Four-year College,No,3.75 to 4.0,3,3,4,3,4,4,3,5,3,3,3,5,5,4,2,5,4,"It gave me a more open and analytical perspective on the things that are going around me. Now I know that there are much more factors that make up the social issues in our community than what we can immediately see with our eyes. I try to think of upstream factors that shape our society and have learned that there are many different approaches we could take to solving problems and depending on what lens/perspective we look through, we can really make a difference. ","I sent out text messages to people that live in the county to let them know about the events that LA Forward hosts and assisted them with RSVPing. If they had questions, I also answered them. I would give them more information about local political candidates or inform them about the events that they were considering attending. I also made sure to opt people out if they wanted to stop receiving the messages. "
3/13/2024 22:00:26,3/13/2024,5405,CESC50XP,Step-Up Tutoring,Mechanical Engineering,,Woman,she/ her,White,No,High School or Less,Two-year College,No,3.5 to 3.75,2,2,3,3,5,4,4,4,4,4,4,4,4,4,4,4,4,It helped me gain an awareness of how much resources and funding STEM looking at outside factors can play such an important role in serving impoverished communities.,I was able to work on data management systems to help the tutoring organization with their parent and student feedback on sessions.
3/13/2024 23:15:07,3/13/2024,4259,CESC50XP,Mar Vista,Psychology,Chicano Studies,Man,Bi-Sexual,Hispanic/Latinx,Yes,High School or Less,High School of Less,No,3.0 to 3.5,3,3,5,4,5,5,5,5,5,5,5,5,5,4,3,,5,"It has really shaped my ability to look at people, in this case, children who has experiences challenges in their personal life. Instead of looking at them within a deficit lens, I look and admire what they are capable of. I look to seek out strengths and validate there strengths by challenging them on things they might not truly comprehend yet. ","I provided support in tutoring. I provided an opportunity for kids to be helped In their classwork and homework. I also help them read a book they felt confident with, while also picking out books that may challenge them. I seek out the most challenging students to work with because to me, their destined to truly make a difference. "
3/14/2024 0:06:02,3/13/2024,4319,CESC50XP,Cancer Care Institute,Psychobiology,n/a,Woman,,White,No,Graduate,Graduate,No,3.75 to 4.0,3,3,5,5,5,5,5,5,5,5,5,5,5,5,5,5,5,"The Cancer Care Institute treats a very diverse range of patients which couldn’t be done without their diverse team. The staff at Cancer Care Institute is very ethnically and curlturally diverse, with hispanic, latino, black, and middle eastern directors, administrators, nurses, etc. running the show. None of this amazing work could be done as successfully without the deep rooted passion of this diverse team. Every single person on the team brings a diverse set of skills and is able to speak their language to each patient, which in this office is predominantly Spanish or Armenian. Having a diverse staff definitely makes the institutions very empathetic towards people from al walks of life, as they handle each patient as their own family. Each staff member contributes to the institution in their unique way by connecting with each patient on a more personal level. 
","The institute and its volunteers utilize a multitude of non-profit organizations which include over 20 non-profit funds associated with pharmaceutical companies as well as over 50 non-profit organizations that dedicate resources to over 30 different types of cancers. Every patient who is unable to afford their medical care is screened, financially, and if they meet appropriate criteria, they will be matched to as many nonprofit funds to assist them with their financial needs to pay for their cancer care.
"
3/14/2024 3:30:41,3/14/2024,5878,CESC50XP,Chrysalis,"Molecular, Cell, and Developmental Biology",,Woman,,Hispanic/Latinx,Yes,High School or Less,High School of Less,No,3.0 to 3.5,2,3,4,3,4,5,5,4,5,4,4,5,5,4,2,5,5,"It impacted my learning about diversity by exposing me to different groups of people that I had never formally engaged with such as people who were formerly incarcerated or who are experiencing homelessness. Apart from being able to acknowledge our differences whether it's our different identities or lived experiences with power and privilege, I noticed that we also have a lot of things in common. This would include hope, interest in social change, having future goals and aspirations, etc.","Something I contributed was my gained experience and knowledge such as facilitating in writing resumes for individuals who are facing workforce barriers and helping to diminish said barrier. As someone who has also had trouble finding jobs/internships, although not in the same degree as some of these community members faced, I was able to give words of encouragement that I had also found helpful, as well as served as a resource to those who may have needed it."
3/14/2024 9:16:48,3/14/2024,3664,CESC50XP,CHIRLA,Political Science and Spanish,,Woman,,White,No,Graduate,Graduate,No,3.75 to 4.0,3,3,4,3,4,4,5,3,3,4,4,4,5,4,4,4,4,It helped me to understand how important diversity is. The community organization I worked with had a lot of diversity and I felt like that was really important to them and the community they were supporting. Having people who are immigrants who are also Latinx helped because they could understand the specific struggles that those people go through that others just can't understnd. ,I helped with my Spanish skills mainly by translating documents from English to Spanish and vice versa. It was amazing getting to work with the legal department at CHIRLA and meet all the incredible people that were there
3/14/2024 9:32:57,3/14/2024,951,CESC50XP,Little Tokyo Service Center,statistics,,Man,,Asian / Pacific Islander,No,Four-year College,Four-year College,Yes,3.75 to 4.0,,,,,,,,,,,,,,,,,,Engaging with community involves working collaboratively towards common goals. ,provide marketing advice
3/14/2024 9:45:55,3/14/2024,2191,CESC50XP,826LA,Political Science,,Woman,,Asian / Pacific Islander,Yes,High School or Less,High School of Less,No,3.75 to 4.0,3,3,4,3,4,5,5,4,5,5,5,5,5,5,1,5,5,,
3/14/2024 11:10:24,11/15/2002,9274,CESC50XP,Little Tokyo Survice center,STATS and Data Science,,Woman,,Asian / Pacific Islander,No,Graduate,Four-year College,No,3.5 to 3.75,2,3,3,4,3,4,5,3,4,3,3,5,3,3,4,3,3,Engaging with individuals from various backgrounds broaden my thoughts of thinking.,I contribute to the web marketing and enhance small business's degital presence.
3/14/2024 12:48:57,3/14/2024,4820,CESC50XP,Food Oasis ,Biology ,N/A,Woman,,Hispanic/Latinx,No,Two-year College,Four-year College,Yes,2 to 2.5,3,2,4,3,4,4,5,4,5,4,4,5,5,5,1,5,5,My experience with my community engagement partner made me realize how places in Los Angeles are really there for their community and want to try to help those with food insecurity by providing free food resources for those in need.,"I contributed to verifying places were still providing food services for those who may be food insecure
"
3/14/2024 13:46:20,9/15/2003,6565,CESC50XP,Green Arrow Co-Lab,Cognitive Science,Theatre,Woman,,"Asian / Pacific Islander, Hispanic/Latinx",No,Four-year College,Four-year College,No,3.5 to 3.75,2,3,4,2,5,3,5,5,5,4,5,5,5,5,2,5,4,"I learned that nothing should be assumed about a person based on their background. Just because someone was incarcerated doesn't make them automatically a ""bad person."" People change and grow, no matter where they come from, and the circumstances they are born into affect that. Have an open mind.","I was able to build a garden at the 580 Cafe from scratch. With my community partner, I gained new insights into systemic justice/abolition and skills in gardening."
3/14/2024 15:42:34,3/14/2024,7075,CESC50XP,Los Angeles LGBTQ Center,Public Affairs,Music Industry ,Woman,,Hispanic/Latinx,No,Four-year College,Graduate,No,3.75 to 4.0,3,3,5,1,5,5,5,4,5,5,5,5,5,5,2,5,5,"My community engaged experience influenced my learning about diversity because the population that the LGBTQ center serves is incredibly diverse. Most of the people that they serve are Black and brown, and queer. The LA LGBTQ center is able to create an environment where those folks feel safe and are able to access the needs that they need. ","I did some tutoring and worked directly with youth supporting college and high school math and english, and did a lot of organizing of their new office, including organizing their bookshelves and cupboards. I also was involved in their morning check-in meetings and was able to hear about their operational plans/concerns.  "
3/14/2024 16:09:06,3/14/2024,8894,CESC50XP,Bresee Foundation,Neuroscience,N/A,Woman,,White,Yes,High School or Less,High School of Less,No,3.75 to 4.0,3,1,3,4,3,5,1,2,4,3,2,5,3,3,1,1,3,"To be 100% honest, I have never felt so divided by race before, and this is coming from someone who went to a high school that was 5% white (as I am).  It was very diverse and we all worked well together without ever learning about how to.  It's tiring to have to explore all the nuances in the topics presented because I think most of the things were true, but I also feel like they were incomplete truths.  I feel like by trying to force diversity you hinder it entirely.  ","I helped out in the tutoring center, cooking class center, and FAFSA workshops.  it was very interesting to see the dynamic that the kids operated in, and it was especially interesting to compare the Harvard Westlake kids (who came to help volunteer one day) and the Bresee kids.  It really made me see that as a kid, circumstance is very important, but they were also very similar in a lot of ways too despite their different experiences.  "
3/14/2024 16:31:37,3/14/2024,5754,CESC50XP,LA LGBT Center,Sociology ,Gender Studies,Prefer not to Say,,Asian / Pacific Islander,Yes,Two-year College,Two-year College,No,3.75 to 4.0,3,3,5,5,5,5,5,5,5,5,5,5,5,5,5,5,5,exposed me to the diversity within LGBT community,"tutoring, office organization, being present"
3/14/2024 18:08:03,3/13/2024,8005,CESC50XP,Seeds to Plate,Undecided Life Science ,none ,Woman,,White,No,Graduate,Graduate,No,3.5 to 3.75,2,2,4,2,4,4,4,4,4,4,4,4,4,4,2,4,3,"Before doing the community engagement experience, I had very little experience working on a farm. I learned how to weed and enjoyed painting signs with middle schoolers, hearing their stories and giving them advice.","I helped maintain the community garden, while also providing advice to middle schoolers."
3/14/2024 19:17:33,4/12/2005,9196,CESC50XP,Rising Communities,Political Science,,Woman,,Asian / Pacific Islander,Yes,Four-year College,High School of Less,No,3.0 to 3.5,1,1,3,2,5,4,5,5,5,5,5,5,5,5,1,5,5,"My engagement with Rising Communities not only exposed me to the surface-level differences among individuals but also delved into the deeper layers of identity, privilege, and systemic barriers. By actively participating in initiatives aimed at addressing social inequalities and promoting inclusion, I witnessed firsthand the transformative power of community collaboration and education. This experience not only broadened my perspective but also instilled in me a sense of responsibility to advocate for equity and justice in all facets of life. Through meaningful interactions and shared experiences, I came to appreciate diversity not just as a concept, but as a fundamental strength that enriches our collective humanity.","Specifically, I collaborated with the community partner to design tailored curriculum materials that catered to the unique needs and interests of the community they serve. Additionally, I played an active role in the implementation phase, offering guidance and support to ensure the successful launch of these projects. My contributions extended beyond the classroom, as I also engaged in outreach efforts, organizing events, and facilitating discussions to promote community involvement and awareness. Overall, my efforts were aimed at empowering individuals within the community and fostering a sense of belonging and agency among its members."
3/14/2024 19:23:55,3/14/2024,2126,CESC50XP,Green Arorw Co-Lab,Public Affairs,n/a,Woman,,Asian / Pacific Islander,No,Two-year College,Graduate,No,3.0 to 3.5,2,3,4,3,5,4,5,2,5,4,5,5,5,5,2,5,4,"I learned more about the value of diversity, especially when it comes to perspectives on input. The idea of community cultural wealth and positionally are something I think about a lot more now. ",I helped activate the garden space they intend to use for involvement with formerly incarcerated youth later. 
3/14/2024 20:32:39,3/14/2024,3018,CESC50XP,Green Arrow Co Lab,Biochem,philosophy,Man,,Black or African American,Yes,High School or Less,Two-year College,Yes,3.5 to 3.75,3,3,2,3,4,3,3,4,5,4,4,4,5,5,1,4,4,"Engaging in sociological imagination allowed me to become familiar with and see societal factors at play in the happenings of our society. Inequalities persist at no fault of the individual and while I've attributed this to the historical context of this country, that I've learned, as an immigrant, much of this same oppressive powers still exists and disrupts liberty by design. It debunks a lot of the myths about moving to America that has been  indoctrinated in us by our immigrant parents that blindly lead us to navigate the factions of American life. Having knowledge about different/diverse groups gives me more perspectives toward where I may find myself in the grand scheme of things and enlighten me about the people that I may have otherwise poorly misjudged.","I was able to set the foundation for the garden in Green Arrow CoLab's community space that would set the stage for the upcoming CESC cohort and young people involved in systemic injustice or that have dealt with incarceration. These community garden spaces are the basis of operation all throughout LA where the direct/downstream solutions take place. By tending the land/soil and planting the first veggies/plants the time spent developing relationships with a group of what we in society considers ""other"" allowed us to remove stereotypes and gain an understanding of the struggles that also factor in our lives. The realization that regardless of our backgrounds we still face the same issues with the same oppressive powers creates a unity where strategies for change can then be advocated for."
3/14/2024 21:14:37,3/14/2024,8123,CESC50XP,Destination Crenshaw,Data Theory ,Data Science Engineering ,Woman,,Hispanic/Latinx,Yes,High School or Less,High School of Less,No,3.75 to 4.0,2,3,5,5,5,5,5,5,5,5,5,5,5,5,5,5,5,It helped me see the experiences many communities are facing and open my eyes to how diverse LA is ,I am a community outreach that created volunteer material 
3/14/2024 21:17:31,3/14/2024,5063,CESC50XP,Hidden Genius Project ,pre Business Economic ,,Man,,Black or African American,Yes,Two-year College,Two-year College,No,2.5 to 3.0,2,1,4,5,5,5,5,5,5,5,1,3,3,5,3,3,5,,
