3/14/2024 22:53:38,3/14/2024,1042,CESC50XP,Destination Crenshaw,Business Economics,Arabic,Man,,Asian / Pacific Islander,No,Four-year College,Graduate,No,3.5 to 3.75,2,3,4,3,5,5,5,4,5,4,5,5,5,5,1,4,4,,"The committee and board for one of their branches is very diverse and opinionated. It was clear they didn't really know all that they were thinking, but I was able to interview and consolidate those perspectives."
3/14/2024 22:56:36,3/14/2024,5355,CESC50XP,Tribal Law and Policy Institute,Computational and Systems Biology,Public Affairs,Woman,,Asian / Pacific Islander,No,Four-year College,Graduate,No,3.75 to 4.0,3,3,4,1,5,5,5,4,5,5,5,5,5,4,3,5,5,"I was aware but unfamiliar with indigenous rights and issues before working with my community partner, and am grateful for the ability to learn more about diversity through a lens deeply connected to agency and sovereignty.","I assisted with outreach materials (informational brochures, updating traditional names of tribes they work with), grant application research, and am now helping conduct a data scan for a project related to tribal youth incarceration."
3/15/2024 0:50:18,3/14/2024,7604,CESC50XP,Museum of Social Justice ,Physiological Science,N/A,Woman,,Hispanic/Latinx,Yes,High School or Less,High School of Less,No,3.75 to 4.0,2,2,5,5,5,5,5,4,5,5,5,5,5,4,2,5,5,"I learned much more about diversity than before. I knew a lot, but this class added a dimension I never had the chance to think critically about. I never thought about intersectionality and the ways this contributes to diversity. My community engagement introduced me to those with intersectional identities and made me identify my own as well. ","I provided my scientific lens to an issue that was spoken about a lot this quarter—health inequalities. Not only am I a STEM major, but I also have lived-in experiences with the subject. Hence,  I was able to share information from multiple perspectives. "
3/15/2024 1:28:32,3/15/2024,7279,CESC50XP,Tribal Law and Policy Institute,Economics,N/A,Man,,Asian / Pacific Islander,No,Four-year College,Two-year College,No,3.75 to 4.0,3,2,4,3,5,4,5,5,5,4,5,4,5,5,2,4,4,"I realized that Diversity isnt simply about an abundance of differences put together in one space; there needs to be an active effort to integrate those voices, and make sure everyone is included and feels comfortable to share their opinions.","I was tasked on a variety of things, including doing background research for writing grant proposals, creating flyers, and scanning existing reports on topics of interest."
3/15/2024 3:15:08,3/15/2024,4723,CESC50XP,Bresee Foundation,"Political Science, Psychology",,Woman,,Asian / Pacific Islander,Yes,High School or Less,High School of Less,No,3.75 to 4.0,3,3,5,3,4,4,5,3,5,4,5,5,5,5,5,5,5,"My community engagement experience impacted my learning about diversity within LA because it allowed me to work with a different group of individuals compared to the people I interact with on a daily basis. These people came from different backgrounds and while back at home I was around a diverse group of people, this experience really allowed me to work alongside a community of people that all came from the same background which was a little new to me. At home, my neighborhood was fairly diverse amongst a few difference ethnicities, but my community engagement experience allowed me to work with mostly one. ","I contributed to my community partner by working with the students the organization works with. Although I was not tasked a whole lot, I still got to see the way the lives of these students were affected by their background and where they grew up. I also went to the food drives my community partner organized bi-weekly and this allowed me to visualize the downstream conditions that need to be addressed for folks that may be facing various insecurities in regards to housing, food, and jobs. By preparing the packages for the community members and interacting with them as they came to get them showed a lot about the community and I was able to be a part of this. "
3/15/2024 10:16:15,3/15/2024,6262,CESC50XP,Step Up Tutoring,Business Economics,,Man,,Multiple Ethnicity / Other,No,Graduate,Four-year College,No,3.5 to 3.75,2,2,4,4,4,4,4,4,5,5,5,5,5,4,2,5,5,My community engagement experiences greatly impacted my learning about diversity because I was able to work with a wide range or families and students across LA. I learned of new needs and different socioeconomic backgrounds of families in LA. ,"I helped my community partner develop a comprehensive list of other organization to potentially partner with. Upon doing this research I learned a ton about different social justice needs in LA. I also worked with families and students and ran a few virtual meetings. For example, tonight I'm running an arts and crafts night with students. I also attended advisory meetings and took notes and spoke in break out rooms. Overall, I had a very positive learning experience."
3/15/2024 10:28:08,3/15/2024,6249,CESC50XP,The Los Angeles Trust For Children's Health,Biochemistry,,Man,,Asian / Pacific Islander,Yes,High School or Less,High School of Less,No,3.75 to 4.0,2,1,3,2,4,4,5,3,5,3,5,5,5,5,2,5,5,Most of the learning came from looking at their website. I was able to learn more about health disparities in Los Angeles especially how it is connected with poverty and socioeconomic status.,I mainly had discussions about a Y2Y event they're hosting in April and gave them ideas. I also sent emails to Community Based Organizations informing them about our event and asked them to table at the event as guest speakers.
3/15/2024 10:43:07,3/15/2024,6200,CESC50XP,Unite HERE local 11,Labor Studies,,Man,,Hispanic/Latinx,Yes,,,No,,2,2,4,2,4,4,4,5,5,4,4,5,4,5,1,4,4,,"We were able to bring support to the workers that we represented. Doing a lot of the behind the scenes work to get turnout to certain events. Doing research, and attending actions. "
3/15/2024 11:22:26,3/15/2023,9,CESC50XP,826LA,Double Major in Cognitive Science and Philosophy,Arabic Studies,Woman,,"Black or African American, White, Multiple Ethnicity / Other",No,Four-year College,Graduate,No,3.75 to 4.0,3,2,4,2,4,4,5,4,5,2,3,3,4,2,4,4,4,"It expanded my learning in a sense where I saw firsthand systemic inequalities in LA, which allowed me to personalize and thus more deeply empathize with the work and the people I was assisting.","I volunteered at the Time Travel Mart, the proceeds of which fund activities to promote academic success in children from disadvantaged backgrounds."
3/15/2024 11:38:39,3/15/2024,6512,CESC50XP,Museum of Social Justice ,Statistics and Data Science ,,Woman,,Asian / Pacific Islander,No,Four-year College,Graduate,No,3.75 to 4.0,2,2,4,4,4,4,4,3,4,3,3,3,4,3,4,4,4,"Engaging with the Museum of Social Justice and developing a learning module on social inequality issues in Los Angeles, particularly focusing on water resources, has profoundly impacted my understanding of diversity and its intersection with social justice. Through extensive research and interaction with the museum's exhibitions and resources, I encountered a diverse array of perspectives and experiences related to social inequality. Exploring the different dimensions of inequality also provided insights into how social inequality intertwines with other forms of oppression, such as race, ethnicity, socioeconomic status, and environmental justice. Additionally, engaging with the museum's community-driven approach and attending exhibitions like ""Comfort Women"" evoked empathy towards marginalized communities and their struggles for justice and equality, empowering me to become a more effective advocate for social change and diversity within my own community.  Overall, this community engagement experience has broadened my understanding of diversity and equipped me with valuable insights and tools to contribute to advocacy efforts for social change and diversity in my community.","During this quarter, I actively collaborated with the Museum of Social Justice to develop a comprehensive learning module addressing social inequality issues in Los Angeles, focusing on water resources. Through thorough research and content creation, I contributed to enhancing the museum's educational resources, empowering community members across age groups to understand and engage with pressing social justice issues. Additionally, I participated in the museum's community-driven initiatives, such as attending the opening day of their newest exhibition, ""Comfort Women,"" and engaging with local voices and stories, amplifying marginalized narratives and fostering empathy within the community. Overall, my contributions this quarter have aimed at enriching educational resources, amplifying marginalized voices, fostering empathy, and promoting awareness and advocacy for social change within the community served by the Museum of Social Justice."
3/15/2024 12:07:35,3/15/2024,3248,CESC50XP,MyUCLA Health Ambassadors,Physiological Science ,,Woman,,Asian / Pacific Islander,No,Graduate,Graduate,No,3.75 to 4.0,3,3,4,4,5,5,4,4,5,5,5,5,5,5,3,5,5,I learned about the diverse nature of LA and truly got exposure to the different backgrounds of individuals in my community.,I contributed my interactions with patients in the Ronald Reagan hospital.
3/15/2024 12:21:23,12/18/2000,3973,CESC50XP,Step Up Tutoring ,Pre Data Theory ,Data Science Engineering ,Man,,"White, Multiple Ethnicity / Other",Yes,High School or Less,High School of Less,Yes,3.5 to 3.75,2,2,1,3,1,3,2,1,2,1,1,5,4,3,2,1,1,It didn't ,Some basic stuff 
3/15/2024 12:30:14,3/15/2024,3564,CESC50XP,826LA,Undeclared,n/a,Man,,White,No,Graduate,Graduate,No,3.5 to 3.75,2,2,4,2,4,4,5,5,5,4,5,5,5,5,1,5,5,"I think having direct conversations with a wide variety of young kids from a variety of different backgrounds gave me a well-rounded view of how the current education system is built. All these kids were smart, funny, talkative, and intuitive yet would remark on wildly different experiences depending on what or where they were schooled. All these conversations exposed me to the fact that the reasons behind educational deficits or surpluses across the city aren't just a race or class or familial or location issue, it's a mixture of all these factors and more. Diversity as a concept shouldn't be a benchmark, it should be a standard.","My community partner required me to create connections with a wide variety of kids of many ages to make them feel comfortable and talkative within the space. During my first session, I honestly found a lack of success because I approached the kids with the thought in mind that they just needed help with their writing and homework. However, I found that instead, I should focus on forging friendships and comradery between me and the kids I was working with. When doing so, I found that first I was able to be a part of some fantastic conversations about who these kids were and why they liked what they liked. Second, I found that once they opened up, the kids' ideas were much more creative and expressive and they went to me much more for homework help. The organization's main goals can only be achieved if the kids feel the space is safe and their ideas will be heard, and I think I contributed to progressing the space even more so to those levels."
3/15/2024 13:14:38,3/15/2024,7458,CESC50XP,826 LA,Cognitive Science,n/a,Woman,,Asian / Pacific Islander,Yes,High School or Less,High School of Less,No,3.5 to 3.75,2,3,4,3,3,2,5,4,5,3,4,5,5,4,3,4,2,My community engagement experience exposed me to more of LA's diversity outside of the UCLA campus which was really cool. I got to meet working people and children growing up in LA. It was refreshing to escape the UCLA bubble and talk to people living in the city for other reasons besides school.,"I offered my time and hopefully helped the kids I tutored. I also worked in the store, checking out customers and helped contribute to 826's social enterprise in this small way. "
3/15/2024 13:45:57,3/15/2024,9057,CESC50XP,Green Arrow Co lab,Ecology Behavior and Evolution,Community engagement and Social change,Woman,,"Asian / Pacific Islander, Hispanic/Latinx, White, Multiple Ethnicity / Other",No,Graduate,Graduate,No,3.75 to 4.0,3,2,4,2,5,5,5,4,5,3,4,5,5,4,1,5,5,"I think it paired well with the lecture side of learning. I learned about the theoreitcal and big picture aspects in class, but in my community engagment it really humanized many of the issues we learned about","I helped work on a community garden at the 580 cafe, which is a space meant to foster relationships within students who are interested in social justice."
3/15/2024 14:07:27,3/15/2024,4414,CESC50XP,Green Arrow Co Lab,Political Science,,Woman,,"Asian / Pacific Islander, Multiple Ethnicity / Other",No,Graduate,Four-year College,No,3.0 to 3.5,3,2,3,2,3,4,4,4,4,4,4,4,4,4,2,4,4,I learned so much about the different things that diverse communities must go through and how to help make a difference in these social inequalities.,I learned valuable ways that my community partner helps incarceration victims heal through nature and self reflection 
3/15/2024 14:15:14,3/15/2024,2016,CESC50XP,Social Justice Learning Institute ,Sociology,,Woman,,Hispanic/Latinx,No,Four-year College,Four-year College,Yes,3.75 to 4.0,3,3,4,2,3,5,5,4,5,5,5,5,5,5,3,5,5,I was able to interact with people of different backgrounds. I also engaged with diverse companies and looked into demographics as well which was interesting. ,I contributed to the logistics and planning of their culmination event through different assignments and work throughout the quarter. I also volunteered when I could.
3/15/2024 14:56:04,3/15/2024,1247,CESC50XP,Destination Crenshaw,History,,Woman,,Hispanic/Latinx,Yes,High School or Less,High School of Less,No,3.5 to 3.75,2,2,4,4,4,5,5,5,5,5,5,5,5,5,5,5,5,,
3/15/2024 15:57:38,3/15/2024,3538,CESC50XP,826LA,American Literature and Culture,"CESC, and Spanish",Woman,she/her,Hispanic/Latinx,Yes,High School or Less,High School of Less,No,3.75 to 4.0,2,2,5,5,5,5,5,5,5,5,5,5,5,5,5,5,5,,"I contributed writing tutoring hours, brainstorming help for creative writing in K-12th graders."
3/15/2024 16:59:01,3/15/2024,7767,CESC50XP,Green Arrow Co-Lab,Business Economics,N/A,Man,N/A,White,No,Graduate,Graduate,No,3.75 to 4.0,3,2,4,3,5,4,5,4,5,4,4,5,4,5,1,4,4,"My community engagement experience impacted my learning about diversity because it opened my eyes to the reality of the entire community I live in. While being at UCLA, I tend to get stuck in the Westwood bubble. After my community engagement experience and by doing a research paper on the affects of incarceration, I have a much deeper understanding on the social injustice and inequality issues that occur all over LA and all over the world. My community engagement experience has also introduced me to more cultures inside Westwood and in the rest of LA.","I contributed to the garden at 580 Cafe, which is one of the places Green Arrow Co-Lab serves. I helped prepare the garden in which welcomes people affected by incarceration to go reconnect with reality with beautiful nature."
3/15/2024 17:01:07,3/15/2024,2330,CESC50XP,Food Forward,Linguistics and Anthropology,,Prefer not to Say,,"Asian / Pacific Islander, White, Multiple Ethnicity / Other",No,High School or Less,Four-year College,No,3.75 to 4.0,3,3,4,2,5,4,5,3,5,3,4,5,5,5,3,5,5,My community engagement experience really showed me how important relationships are and maintaining a rapport and good attitude with social injustice and participating in community engagement. ,"I was able to provide help to the weekly gleans, because the process is constant and they always need people, it was very helpful to be at least one person they could rely on to be there every week for 8 weeks because they always need someone to be there and help out. "
3/15/2024 17:30:14,3/15/2024,2593,CESC50XP,826LA,Psychobiology,,Man,,Asian / Pacific Islander,No,Graduate,Graduate,No,3.75 to 4.0,3,3,4,4,5,5,4,5,4,4,4,5,5,4,2,5,4,,
3/15/2024 19:30:18,3/15/2024,1190,CESC50XP,Stop LAPD Spying Coalition,Public Affairs ,,Woman,,White,No,Graduate,Four-year College,No,3.75 to 4.0,3,2,4,1,4,5,5,4,5,4,5,5,5,5,2,5,5,,
3/15/2024 19:36:55,3/15/2024,5645,CESC50XP,Museum of Social Justice,Mathematics/Economics,,Woman,,Asian / Pacific Islander,No,Graduate,Four-year College,No,3.75 to 4.0,2,2,4,3,4,4,4,4,5,4,5,4,5,5,2,5,5,"I knew that certain demographics tend to have very different experiences in life than others, but I was able to understand what systemic factors are in play that lead to this.","I created a digital learning module about labor exploitation in the United States/Los Angeles, discussing sweatshops, human trafficking, and the Thai El Monte garment workers case. My work was based on a previous exhibition at the Museum about the Thai El Monte garment workers. It will be published on the MSJ website."
3/15/2024 20:12:13,3/15/2024,6192,CESC50XP,Seeds to Plate,Civil Engineering,,Man,,"Asian / Pacific Islander, White, Multiple Ethnicity / Other",No,Graduate,Graduate,No,3.5 to 3.75,3,3,4,2,5,4,4,5,5,4,5,5,5,4,1,5,5,,"I was able to serve as a trustworthy and fun mentor to the middle school students in the program, as I had a lot of experience working with children in the past. Additionally, as an engineering student, I was able to build items that enhanced the garden learning experience, as well as create functional tools, such as maps, to be used as reference in the future."
3/15/2024 20:48:34,3/15/2024,5686,CESC50XP,Little Tokyo Service Center,Business Economics,,Man,,White,No,Four-year College,Graduate,No,3.0 to 3.5,2,3,4,4,4,5,2,4,2,3,4,5,5,5,1,4,5,I was able to spend a large amount of time in the asian american community and which opened my eyes toward some nuances of life i wasnt quite aware of before ,"I helped revamp social media channels, create ever green content, and capture social media content during a Far Bar special event."
3/15/2024 22:06:46,3/15/2024,8894,CESC50XP,Bresee Foundation,Neuroscience,,Woman,,White,Yes,High School or Less,High School of Less,No,3.75 to 4.0,3,1,4,4,4,4,1,2,4,4,2,5,3,3,1,1,2,"I learned that as a child, circumstance is everything, but as an adult, you have a greater sense of agency to determine your own outcome.","Helped with tutoring, cooking classes, food distribution, FAFSA workshop."
3/15/2024 22:14:56,3/15/2024,4982,CESC50XP,Stop LAPD Spying,Political Science,Public Affairs,Woman,,Asian / Pacific Islander,No,Two-year College,Graduate,No,3.75 to 4.0,3,3,4,1,5,4,5,4,5,5,5,5,5,5,5,5,5,,
3/15/2024 22:23:48,3/15/2024,6262,CESC50XP,Step Up Tutoring,Business Economics,,Man,,White,No,Graduate,Four-year College,No,3.5 to 3.75,2,2,4,4,4,5,5,5,5,4,5,5,5,5,1,5,5,My community engagement experience majorly impacted my learning about diversity because of all the students and families from different areas of LA I worked with. ,I researched many different organizations Step Up could partner with and also ran events for the students. I also took notes on family advisory meetings. Overall my work benefits the organization as well as the students.
3/15/2024 23:10:59,3/15/2024,8921,CESC50XP,Refugee Children Center,Sociology,undeclared,Woman,,Hispanic/Latinx,No,Four-year College,,No,3.5 to 3.75,2,2,4,3,5,5,5,3,5,4,5,5,5,5,1,5,5,"Coming from a diverse background, I have always been surronded by a multitude of diffrent cultures. Volunteering at the RCC allowed me to foster that experince and apply it to the concepts we were learning in class. Engaging with the communities exposes the complex social, economic, and political systems that contribute to diversity issues. This allowed me to better understand the impact of the systemic inequalities and injustices. ","Being at the RCC allowed me to connect with individuals of diffrent backgrounds. I specifically worked with the kids, and was able to make very strong bonds. This opened the path to better understanding them and making them feel at home. "
3/15/2024 23:41:59,3/15/2024,3837,CESC50XP,LA Forward ,Human Biology and Society ,Chicano Studies ,Woman,,Hispanic/Latinx,Yes,Two-year College,High School of Less,No,3.0 to 3.5,3,3,4,3,3,4,4,3,4,3,4,5,5,5,2,5,5,Working with LA Forward allowed me to see diverse perspectives in the community. This quarter I helped with voter turnout which allowed me to engage with the community and hear about their political opinions and policies that were important to the community.,This quarter I invited many LA community members to attend LA Forwards ballot events which helped the community understand what they're voting for. I texted about 250+ people every week. I successfully reached several people which helped pass things like MeasureHLA (a safe streets ballot measure) and many of LA forwards endorsed candidates are in the lead
3/15/2024 23:42:16,3/15/2024,6617,CESC50XP,Green Arrow Co-Lab,Psychology,,Woman,,Hispanic/Latinx,Yes,High School or Less,,No,3.75 to 4.0,2,2,4,2,5,5,5,3,5,5,5,5,5,5,5,5,4,"My community engagement experience impacted my learning about diversity as I was able to learn different perspectives from so many different people. I now approach and view aspects of life with more caution, I make sure to take in these perspectives that I have learned.","I was able to plant a few vegetables for the organization that I partnered with, and hopefully those vegetables can go to students in need of fresh produce when they are ready to be harvested. Additionally, I helped with the social media of my partner, so I am hoping they can receive more engagement and help a wider community."
3/16/2024 0:04:11,3/15/2024,3221,CESC50XP,Food Oasis,Biochemistry,Public Health,Non-Binary / Genderqueer / Gender Fluid,,"White, Multiple Ethnicity / Other",Yes,Four-year College,Four-year College,No,3.0 to 3.5,2,2,4,3,5,5,5,4,5,4,5,5,5,5,5,5,5,"My community engagement experience allowed me to capture and learn more about individuals' experiences and stories. From listening to the diverse communities that Los Angeles houses, I was able to gain new perspectives and a new outlook.","For my community partner, I was involved in confirming information and ensuring that food banks and pantry resources are available and updated for those in need. Through my experience, from research or contacting members in charge of food services, I learned about how these downstream implementations play a part in our society and what sort of services they offer to alleviate food insecurity."
3/16/2024 13:32:13,3/16/2024,5115,CESC50XP,STEM Academy of Hollywood,"Ecology, Behavior, and Evolution",,Woman,,Multiple Ethnicity / Other,No,Four-year College,High School of Less,No,3.75 to 4.0,3,3,5,3,5,4,5,5,5,5,5,5,5,5,5,5,5,I felt that it taught me a lot about diversity and was my favorite part of the course. ,I felt I was bel to connect with the students at STEm Academy and improve their confidence and competence in math and science. 
3/16/2024 15:34:23,3/16/2024,6227,CESC50XP,LA LGBT Center,Global Jazz Studies,N/A,Man,,Asian / Pacific Islander,No,Four-year College,High School of Less,No,3.5 to 3.75,3,3,4,1,4,3,5,5,5,4,5,5,5,5,1,5,5,,
3/17/2024 1:54:36,3/17/2024,8369,CESC50XP,Koreatown Youth and Community Center,Psychology,,Woman,,White,No,Graduate,Graduate,No,3.75 to 4.0,3,3,4,4,4,4,4,4,4,4,4,4,4,5,2,4,4,I learned a lot about LA disparities and how to make change in society,I served as a peer volunteer and assisted with administrative and social work
3/17/2024 2:26:34,3/17/2024,3584,CESC50XP,Initiate Justice,Sociology ,Information and media Literacy ,Man,,Black or African American,No,Two-year College,High School of Less,Yes,3.0 to 3.5,3,2,2,1,2,5,5,5,5,5,5,5,5,4,1,4,4,I think it helped me learn more about the formerly incarcerated for sure. ,I helped them with social media and getting more engagement 
3/17/2024 9:27:13,3/17/2000,2847,CESC50XP,Seeds of Hope,"Microbiology, Immunology, and Molecular Genetics ",NA,Woman,NA,Hispanic/Latinx,Yes,High School or Less,High School of Less,Yes,2.5 to 3.0,2,2,4,3,5,4,5,5,5,3,5,5,5,5,1,5,5,"helped me learn that it isn’t just one race that is struggling. It’s a lot. quite frankly, there’s a little bit of everyone. ","I contributed my time, knowledge, kindness and i passed produce to those with food insecurity "
3/17/2024 20:51:55,3/17/2024,9759,CESC50XP,Seeds of hope ,MIMG ,N/A,Woman,,Hispanic/Latinx,Yes,High School or Less,High School of Less,Yes,3.5 to 3.75,1,1,4,5,5,4,4,4,3,5,4,5,4,3,4,3,4,It showed me that circumstance is the largest upstream cause to many inequalities ,Slides that display benefits if eating foods that were being handed out at the farmers market
3/21/2024 20:12:15,3/21/2024,9745,CESC50XP,Stop LAPD Spying Coalition,"Neuroscience, B.S.",Biomedical Research,Woman,,Asian / Pacific Islander,No,Four-year College,Four-year College,No,3.75 to 4.0,3,3,5,5,5,5,5,5,5,5,5,5,5,5,5,5,5,I was able to learn more about the populations in LA that are disproportionately impacted by policing.,I was able to create infographics for them and organize outreach efforts for fellow interns.
3/13/2024 17:38:25,3/13/2024,8571,CESC50XP,826LA,Stats and Date Science,undecided ,Man,N/A,Hispanic/Latinx,No,Graduate,Graduate,No,3.0 to 3.5,2,2,3,3,3,3,3,3,3,3,3,3,3,3,3,3,3,My community engagement allowed my knowledge of upstream conditions to grow and what hidden issues dominate our lives.,I helped low income children with their writing skills and worked as a cashier for the nonprofit's time market.
,,,,,,,,,,,,,,,,,,,,,,,,,,,,,,,,,
3/12/2024 17:14:36,3/12/2024,889,DISSTD M172XP,Momentum,Human Biology and Society,Biomedical Research,Woman,,Asian / Pacific Islander,No,High School or Less,Four-year College,No,3.75 to 4.0,2,3,4,2,4,4,4,4,4,4,4,4,4,4,4,4,4,,
